{
  "operation": "spellcheck",
  "mode": "raw",
  "provenance": {
    "endpoint": "https://api.search.brave.com/res/v1/spellcheck/search",
    "synthetic": true,
    "http_status": 200
  },
  "truncated": false,
  "raw": {
    "type": "spellcheck",
    "query": {
      "original": "orbitl gardens"
    },
    "results": [
      {
        "query": "orbital gardens"
      }
    ]
  }
}
